input_text,target_text,prefix
"I've always found LOCATION1 to feel quite safe, but up nearer LOCATION2 it can feel a bit less secure",LOCATION1 - safety ~~ LOCATION2 - safety,AD
"I've always liked LOCATION1 and LOCATION2 meself, hon",LOCATION1 - general ~~ LOCATION2 - general,AD
I've always loved the area around LOCATION1,LOCATION1 - general,AD
"I've had some recommendations that I stay along bayswater Road around the LOCATION1 Station as it is ""nicer"" and ""safer""",LOCATION1 - general ~~ LOCATION1 - safety,AD
I've heard from a few ex work mates the council areas in LOCATION1 are not very nice but it's not personal experience though,LOCATION1 - general,AD
I've heard that LOCATION2 and LOCATION1 are dangerous,LOCATION1 - safety ~~ LOCATION2 - safety,AD
I've learned that LOCATION1 is home to luxiury and wealth,LOCATION1 - price,AD
"I've lived in LOCATION1 all my life, and  haven't had many problems  LOCATION1 has changed so much",LOCATION1 - safety,AD
I've spent a lot of time in LOCATION1 and can confirm it's generally quite a deprived area and certainly not that safe after dark,LOCATION1 - general ~~ LOCATION1 - safety,AD
"IF money was no option, AND if i could have a house in this particular place, then i would say LOCATION1",LOCATION1 - live ~~ LOCATION1 - price,AD
"Id love to live in the LOCATION1 area, it looks so nice and clean and transport is great in there",LOCATION1 - transit-location ~~ LOCATION1 - general ~~ LOCATION1 - live,AD
"If I could afford to buy there, I would  LOCATION1 is one of the most expensive areas in London and there aren't a lot of single people",LOCATION1 - price,AD
If I had a few million spare I'd love to buy a house in LOCATION1,LOCATION1 - price,AD
If I wanted to be near the centre I would go for LOCATION1 (so East),LOCATION1 - transit-location,AD
"If I were personally buying a property in London, I would probably go for LOCATION1 as it is a great area, always in demand",LOCATION1 - general,AD
If anyone offered me a place on The LOCATION1 I'd jump at it,LOCATION1 - general,AD
If i had to choose between the two i would definitely go for LOCATION1 though,LOCATION1 - general,AD
"If it is just the lifestyle you want and you can afford it , LOCATION1 is very popular with the young trendy after work crowd ( mainly media types ) with lots of nice bars and restaurants and organic bakeries and the like",LOCATION1 - dining ~~ LOCATION1 - nightlife,AD
If it is n't too expensive LOCATION1 would be a good bet as well,LOCATION1 - general,AD
"If not central,   LOCATION1 if you're rich",LOCATION1 - transit-location ~~ LOCATION1 - price,AD
"If so, take the DLR to LOCATION1 and enjoy the big shopping mall there",LOCATION1 - shopping,AD
"If you 're a young male drug-dealer who takes part in the occasional heist , then yes , LOCATION1 could be dangerous for you",LOCATION1 - safety,AD
"If you are an average person, you wont be able to afford to live right near LOCATION2 or LOCATION1",LOCATION1 - price ~~ LOCATION2 - price,AD
"If you are at the end adjoining LOCATION2 and LOCATION1, you should be all right",LOCATION1 - general ~~ LOCATION2 - general,AD
"If you are looking for somewhere a bit quieter, then try LOCATION1, or somewhere like that",LOCATION1 - quiet,AD
If you are not bothered about having a train/tube station you could try LOCATION1,LOCATION1 - transit-location,AD
If you are not planning on going out that much in the evenings LOCATION1 would be ok,LOCATION1 - general ~~ LOCATION1 - nightlife,AD
If you are on the main LOCATION1 then it may be noisy,LOCATION1 - quiet,AD
"If you are rich, you might live in LOCATION1",LOCATION1 - price,AD
"If you are thinking north, then perhaps look at LOCATION1",LOCATION1 - general,AD
If you are young and want a nightlife and lively area then LOCATION1 is good,LOCATION1 - nightlife,AD
"If you can afford more, then move somewhere better (LOCATION1 or LOCATION2)",LOCATION1 - general ~~ LOCATION1 - price ~~ LOCATION2 - price ~~ LOCATION2 - general,AD
If you can afford to live in LOCATION1 then go for it,LOCATION1 - general ~~ LOCATION1 - price,AD
"If you come to London the majority of ""Tourist Attractions"" are based in LOCATION1 too",LOCATION1 - touristy,AD
"If you consider living with the Bengals and Asian, then LOCATION1 is good;",LOCATION1 - multicultural,AD
"If you don't have a lot of budget, you could flat share in LOCATION1 as it is quite expensive",LOCATION1 - price,AD
"If you end up down there, be sure to check out LOCATION1 Market if you like vintage and small designers and handmade stuff, especially clothes",LOCATION1 - shopping,AD
If you go a little further west to LOCATION1 or LOCATION2 you will still be near the central area and presumably pay a litlle less  chk out  berlin,LOCATION1 - transit-location ~~ LOCATION2 - transit-location ~~ LOCATION2 - price ~~ LOCATION1 - price,AD
If you go by tube then West LOCATION1 is nice,LOCATION1 - general,AD
If you have a little more money look at LOCATION1 or LOCATION2,LOCATION1 - price ~~ LOCATION2 - price,AD
"If you have loads of money , LOCATION1 is beautiful but expensive It depends what your budget is , LOCATION1 one of the poshest",LOCATION1 - general ~~ LOCATION1 - price,AD
"If you like London living and want to be near the centre of London , then LOCATION1 is a good choice",LOCATION1 - transit-location,AD
"If you look at the map above, LOCATION1 is generally cheaper to live than LOCATION1",LOCATION1 - price,AD
If you must live in London I would suggest LOCATION1 - it has far more life and,LOCATION1 - general ~~ LOCATION1 - live,AD
If you need to commute to London on a daily basis then LOCATION1 is at the end of the District Line and is a decent area,LOCATION1 - transit-location ~~ LOCATION1 - general,AD
If you really want action you could even live in LOCATION1 for that kind of money,LOCATION1 - price ~~ LOCATION1 - nightlife,AD
If you scoot across a little way to LOCATION1 it's nice but LOCATION2 itself is pretty rough,LOCATION1 - general ~~ LOCATION2 - safety,AD
If you want a bit better quality of life  consider LOCATION1 and LOCATION2  being the nicest in my opinion,LOCATION1 - general ~~ LOCATION1 - live ~~ LOCATION2 - live ~~ LOCATION2 - general,AD
"If you want a nice peaceful area to live in, I would suggest LOCATION1",LOCATION1 - live ~~ LOCATION1 - quiet,AD
If you want a place near the centre that's fairly cheap: try LOCATION1,LOCATION1 - transit-location ~~ LOCATION1 - price,AD
"If you want a proper genuine street market, visit LOCATION1 market near Ladbroke Grove on Saturday",LOCATION1 - shopping,AD
If you want cheaper head more over towards LOCATION2 or LOCATION1 is cheaper again and would be more convenient travel-wise for the London,LOCATION1 - transit-location ~~ LOCATION1 - price ~~ LOCATION2 - price,AD
If you want lots of clubs/bars in one place then I would suggest LOCATION1,LOCATION1 - nightlife,AD
"If you want posh and near LOCATION2, than go for LOCATION1",LOCATION1 - general ~~ LOCATION1 - price,AD
If you want slightly nicer  look at homes in LOCATION1,LOCATION1 - general,AD
"If you want something cheaper then look at the LOCATION2, LOCATION1",LOCATION1 - price ~~ LOCATION2 - price,AD
If you want somewhere more funkier and trendier - what about LOCATION1,LOCATION1 - general,AD
If you want to take risks walk around LOCATION1(istan) E,LOCATION1 - safety,AD
"If you were to go out to somewhere like LOCATION1, then you would have a very long commute to the London",LOCATION1 - transit-location,AD
"If you're interested in music, journalism, and nightlife then somewhere like LOCATION1 or LOCATION2 is the place for you",LOCATION1 - nightlife ~~ LOCATION2 - nightlife,AD
If you're looking at buying a flat in LOCATION1 you will have to bring a lot of money,LOCATION1 - price,AD
"If your budget won't stretch to those, you could try a bit further down the road in LOCATION1",LOCATION1 - price,AD
If your poor you cant live in LOCATION1 without paying a hell of a lot for one tiny bedroom,LOCATION1 - price,AD
"In LOCATION1 you've got the big three: the VandA, the Natural History Museum, and the Science Museum",LOCATION1 - touristy,AD
In LOCATION2 LOCATION1 has some nice streets,LOCATION1 - general,AD
"In West London the areas of LOCATION2 and LOCATION1 are very nicelots of green space, nice housing, good transportation links, but it's expensive",LOCATION1 - transit-location ~~ LOCATION2 - transit-location ~~ LOCATION1 - price ~~ LOCATION2 - price ~~ LOCATION1 - green-nature ~~ LOCATION2 - green-nature,AD
"In contrast, LOCATION1 is lovely - leafy, EXTREMELY highly sought after - house prices through the roof",LOCATION1 - green-nature ~~ LOCATION1 - general ~~ LOCATION1 - price,AD
In fact I can't think of any where better fo you lo live then LOCATION1,LOCATION1 - live,AD
In fact I've never once even seen a fight on the streets in LOCATION1 and I go out all the time during the week,LOCATION1 - safety,AD
In fact LOCATION1 and LOCATION2 are two of the cheapest London boroughs there are,LOCATION1 - price ~~ LOCATION2 - price,AD
"In fact the only people I know who have been mugged have been two people living in LOCATION1, one of the most expensive areas of London, and LOCATION2, another ridiculously expensive area",LOCATION1 - safety ~~ LOCATION1 - price ~~ LOCATION2 - price,AD
"In general , LOCATION1 is a good choice , do some more research and you might be able to find a good house share or a 1 bed flat too for a decent rental price",LOCATION1 - general,AD
"In living and working in the LOCATION1 I can say im pretty happy with where i live, however i do live right on the river",LOCATION1 - live,AD
In my first year I lived in LOCATION2/LOCATION1 - it is definitely a safe and central area and relatively affordable,LOCATION2 - transit-location ~~ LOCATION1 - price ~~ LOCATION1 - safety ~~ LOCATION2 - price ~~ LOCATION1 - transit-location ~~ LOCATION2 - safety,AD
Inner suburbs like LOCATION1 and LOCATION2 are also worth considering especially if you plan to go out at night and want a taxi ride home that wo n't cost a fortune,LOCATION1 - general ~~ LOCATION2 - general,AD
Is it because LOCATION1 is a ` poor and more multicultural area ',LOCATION1 - general ~~ LOCATION1 - multicultural,AD
"It 's a very nice locale , pretty much matches the description of what you are looking for , and you can probably find a place round there that is suitably expensive LOCATION1 is okay",LOCATION1 - general,AD
It 's actually quite good LOCATION1 is a very very desirable area - amazing that you can afford to live there as a student,LOCATION1 - general ~~ LOCATION1 - price,AD
It 's similar to LB LOCATION2 on the opposite side To be honest LOCATION1 is n't the safest place in the world but it does n't get any nicer down South,LOCATION1 - safety,AD
"It 's true there are more ` upmarket ' areas of London , but for me the LOCATION1 has the right mix of the rough and the smooth",LOCATION1 - general,AD
"It also depends on how far you need to travel for work , not that that 's much of an issue in London LOCATION1 is undoubtedly the nicest area , but im prob a bit biased",LOCATION1 - general,AD
"It boosts exciting things like Royal observatory , rolling slopes , tennis courts , deer enclosure etc If you like parks and you are fond of recreation then LOCATION1 is definitely the right place to be",LOCATION1 - green-nature,AD
"It depends what you mean by bad , even LOCATION2 and LOCATION1 have areas I am wary of at night for safety reasons",LOCATION1 - safety ~~ LOCATION2 - safety,AD
It does n't matter which side LOCATION1 is safe i go to school there and ive never had a problem in LOCATION1,LOCATION1 - safety,AD
"It has a large Jewish community going up towards LOCATION1, so plenty of matzos, salt beef and bagels",LOCATION1 - multicultural,AD
It has mainly Muslim immigrants in LOCATION1 now i live there,LOCATION1 - multicultural,AD
"It is OK To be honest, LOCATION1 has got a lot better than it used to be - really cleaned up it's act",LOCATION1 - general,AD
It is a very big place and LOCATION1 costs more than LOCATION1,LOCATION1 - price,AD
"It works LOCATION1 has great bars , shops , cafes , restaurants etc and is a really easy commute to most places in Central London",LOCATION1 - dining ~~ LOCATION1 - nightlife ~~ LOCATION1 - transit-location ~~ LOCATION1 - shopping,AD
It's also got excellent transport infrastructure connecting LOCATION1 to central London,LOCATION1 - transit-location,AD
It's close to everything and 5 different tube lines converge at LOCATION1 station,LOCATION1 - transit-location,AD
Its shopping area LOCATION1 is full of interesting shops and restaurants,LOCATION1 - dining ~~ LOCATION1 - shopping,AD
Just going for walks around the lake in LOCATION2 and the LOCATION1  made me think that it is a perfect place for me to live,LOCATION2 - live ~~ LOCATION1 - live,AD
Just living in LOCATION1 does not mean you will automatically become a victim of crime,LOCATION1 - safety,AD
"Just looking briefly, it shows me that the closer to the centre, the more dangerous the area, with LOCATION1 having the most crime",LOCATION1 - safety,AD
Just stay away from LOCATION1/LOCATION2 Lane,LOCATION1 - general ~~ LOCATION2 - general,AD
Just stay away from LOCATION1/LOCATION2/,LOCATION1 - general ~~ LOCATION2 - general,AD
Just stay away from LOCATION2 and LOCATION1 - gang and crime capitals,LOCATION1 - price ~~ LOCATION2 - safety,AD
Know people in LOCATION1's affordable and decent and close to decent places,LOCATION1 - transit-location ~~ LOCATION1 - general ~~ LOCATION1 - price,AD
LB LOCATION1 is closer to the centre,LOCATION1 - transit-location,AD
LOCATION1   has a lot of Market stalls selling alternative/punk/goth stuff,LOCATION1 - shopping,AD
"LOCATION1  Just saying, it's too expensive",LOCATION1 - price,AD
"LOCATION1  Relatively safe, pleasant, close to the country and a large forest called LOCATION2",LOCATION1 - green-nature ~~ LOCATION1 - safety,AD
LOCATION1  and LOCATION2 are lovely,LOCATION1 - general ~~ LOCATION2 - general,AD
"LOCATION1  at dark nights, is not safe",LOCATION1 - safety,AD
LOCATION1  by comparison with other Surrey postcode options  is the most affordable,LOCATION1 - price,AD
LOCATION1  has lots of nice shops and restaurants,LOCATION1 - dining ~~ LOCATION1 - shopping,AD
"LOCATION1  has no soul, no proper shops",LOCATION1 - general,AD
LOCATION1  is also an area you might be lucky enough to find a two or two and a half bedroom flat in your price range,LOCATION1 - price,AD
LOCATION1  is getting better,LOCATION1 - general,AD
LOCATION1  is nothing special,LOCATION1 - general,AD
"LOCATION1  offer the best in terms of value for money, LOCATION2 is very expensive",LOCATION1 - price ~~ LOCATION2 - price,AD
"LOCATION1  tube station can be bad, had a friend stabbed there",LOCATION1 - safety,AD
"LOCATION1 ( BR3 ) is a very nice suburb , mostly very safe and clean , nice park , good train links , you might well find something in that price range",LOCATION1 - transit-location ~~ LOCATION1 - quiet ~~ LOCATION1 - price ~~ LOCATION1 - safety ~~ LOCATION1 - green-nature,AD
LOCATION1 ( SW18 ) is another OK area b,LOCATION1 - general,AD
"LOCATION1 ( SW4 ) has a very good range of restaurants , 3 tube stations , good rail and bus links and lots of pubs",LOCATION1 - transit-location ~~ LOCATION1 - dining ~~ LOCATION1 - nightlife,AD
LOCATION1 ( mainly E14 ) is smart and comfortable but a long way from everywhere and totally dead at night,LOCATION1 - transit-location ~~ LOCATION1 - general ~~ LOCATION1 - nightlife,AD
"LOCATION1 ( n1 n2 ) is a nice area with easy links to get into Central London , its not too expensive either",LOCATION1 - transit-location ~~ LOCATION1 - general ~~ LOCATION1 - price,AD
LOCATION1 ( where I grew up ) is an okay place to live as its got a large portugese community,LOCATION1 - live ~~ LOCATION1 - multicultural,AD
LOCATION1 (: i love it,LOCATION1 - general,AD
"LOCATION1 (Location- South West) - expensive area LOCATION2 (Location- Central) - Beautiful, expensive suburb",LOCATION1 - price ~~ LOCATION2 - price ~~ LOCATION2 - general,AD
LOCATION1 (Location- West) - A fair way to Central London but a nice suburb with bars and pubs,LOCATION1 - transit-location ~~ LOCATION1 - general ~~ LOCATION1 - nightlife,AD
"LOCATION1 (Location-North West) - Quiet, cheap LOCATION2 Broadway (Location- West) - A fair way to Central London but a nice suburb with bars and pubs",LOCATION2 - transit-location ~~ LOCATION1 - quiet ~~ LOCATION1 - price ~~ LOCATION2 - nightlife,AD
"LOCATION1 (Location-South West) - Fairly central suburb, with the O2 Shopping Centre",LOCATION1 - transit-location ~~ LOCATION1 - shopping,AD
"LOCATION1 , Sloan Square is a nice area and Saatchi Gallery is a great museum , it is definitely worth a visit",LOCATION1 - general ~~ LOCATION1 - touristy,AD
"LOCATION1 , a lively area for going out and shopping is just a 10 minute bus ride away",LOCATION1 - transit-location ~~ LOCATION1 - nightlife ~~ LOCATION1 - shopping,AD
"LOCATION1 , as generally the ` cheapest ' part of London in which to live ,  has been the ` landing ' place for most of the immigatrion into the UK since records began",LOCATION1 - multicultural ~~ LOCATION1 - price,AD
"LOCATION1 , especially near the High St is a posh place to live",LOCATION1 - price,AD
"LOCATION1 , for example , is a trendy , up-and-coming area - but you may not like it",LOCATION1 - general,AD
"LOCATION1 , has a bad reputation but they are developing this area and it 's looking great",LOCATION1 - general,AD
"LOCATION1 , with portobello mkt , is antiques and flea mkt , w a bit of new designers thrown in - some of the week day fruit and veg mkt is the bit hugh grant walks along in the film Notting Hill",LOCATION1 - shopping,AD
LOCATION1 - A very notorious area,LOCATION1 - general,AD
"LOCATION1 - Another up and coming area, pretty central, some crime but not too bad",LOCATION1 - transit-location ~~ LOCATION1 - general ~~ LOCATION1 - safety,AD
"LOCATION1 - Bit alternative, big rock and jazz influence, it where Amy Winehouse lived , might find an okay flat, very central",LOCATION1 - transit-location ~~ LOCATION1 - nightlife,AD
"LOCATION1 - Good shops, some nice restaurants/bars, a little out of central London but very easy to get to most places on the Central Line or by bus",LOCATION1 - dining ~~ LOCATION1 - nightlife ~~ LOCATION1 - transit-location ~~ LOCATION1 - shopping,AD
LOCATION1 - Nice family neighbourhood,LOCATION1 - general,AD
"LOCATION1 - Up and coming, popular with young professionals",LOCATION1 - general,AD
"LOCATION1 - bit further out, good neighbourhood, good schools",LOCATION1 - transit-location ~~ LOCATION1 - general,AD
LOCATION1 - boring area,LOCATION1 - general,AD
LOCATION1 - great rides and it's easy to get to by train,LOCATION1 - transit-location,AD
LOCATION1 - posh and expensive,LOCATION1 - price,AD
LOCATION1 - wildly overpriced but cool,LOCATION1 - general ~~ LOCATION1 - price,AD
"LOCATION1 / LOCATION2 area is lovely, my brother lives there with his wife and two young children and they're very happy",LOCATION1 - general ~~ LOCATION2 - general,AD
LOCATION1 AND LOCATION2 IS STILL RIGHT IN CENTRAL London SO YOULL BE CLOSE TO EVERYTHING,LOCATION1 - transit-location ~~ LOCATION2 - transit-location,AD
LOCATION1 Council is usually very good and very helpful,LOCATION1 - general,AD
"LOCATION1 London Farm has an award-winning cafe, as well as pigs, goats, sheep, and more",LOCATION1 - green-nature,AD
"LOCATION1 London Farm has donkey rides, pony-care classes, and milking demonstrations, all available on request, as well as a range of talks on the farm and lots of hands-on-work with the animals",LOCATION1 - green-nature,AD
"LOCATION1 Market is an amazing alternative street fashion, novelty and multi-cultural street market which is colourful, full of street art, canals with narrow boats, vintage, punk, one-off boutiques, antiques and music",LOCATION1 - green-nature ~~ LOCATION1 - multicultural ~~ LOCATION1 - shopping,AD
LOCATION1 Market is pretty much all tourists,LOCATION1 - touristy ~~ LOCATION1 - shopping,AD
"LOCATION1 Road has plenty of restaurants and coffee shops, many of which are Israeli",LOCATION1 - dining,AD
"LOCATION1 SE10 ,FULL OF PUBS CLUBS AND A BIT OF LOCAL HISTORY",LOCATION1 - nightlife,AD
LOCATION1 Station is connected to both London Bridge Railway Station and victoria Stations,LOCATION1 - transit-location,AD
LOCATION1 Village is easily walkable and extremely pleasant (but probably a bit pricey for accommodation)  it's literally like a country village on your doorstep in Inner London,LOCATION1 - transit-location ~~ LOCATION1 - general ~~ LOCATION1 - price,AD
"LOCATION1 Village is gorgeous and expensive, parts almost feel rural",LOCATION1 - general ~~ LOCATION1 - price,AD
LOCATION1 Village near the common is far nicer if you can afford it,LOCATION1 - general ~~ LOCATION1 - price,AD
"LOCATION1 a decent neighbourhood  with plenty of great bars , a famous market (Portobello) and enough restaurants, shops and transport options to keep you happy",LOCATION1 - dining ~~ LOCATION1 - nightlife ~~ LOCATION1 - general ~~ LOCATION1 - transit-location ~~ LOCATION1 - shopping,AD
LOCATION1 a generally a very safe area so there is no need to be scared of travelling alone,LOCATION1 - safety,AD
"LOCATION1 again, good transport but depending where you go you could have Spurs fans in the area",LOCATION1 - transit-location,AD
LOCATION1 ain't cheap though,LOCATION1 - price,AD
LOCATION1 also has a lot of cheap nice flats hope dis helps,LOCATION1 - price,AD
"LOCATION1 also has cool , unique shops : you can easily spend a day eating , shopping , then clubbing there",LOCATION1 - dining ~~ LOCATION1 - nightlife ~~ LOCATION1 - shopping,AD
LOCATION1 also has good transport links into the centre of town with the district line and a good overland rail service,LOCATION1 - transit-location,AD
LOCATION1 also has some good restaurants,LOCATION1 - dining,AD
"LOCATION1 and LOCATION2 ( where I live ) is a really posh area , there 's even a TV show on it",LOCATION1 - price ~~ LOCATION2 - price,AD
LOCATION1 and LOCATION2 are a bit further out which has advantages but it does take longer to get anywhere,LOCATION1 - transit-location ~~ LOCATION2 - transit-location,AD
"LOCATION1 and LOCATION2 are also very , very nice",LOCATION1 - general ~~ LOCATION2 - general,AD
LOCATION1 and LOCATION2 are both in Zone 2 and within easy reach of central London by Tube/Train/Bus,LOCATION1 - transit-location ~~ LOCATION2 - transit-location,AD
LOCATION1 and LOCATION2 are considered safe but there isn't much to do in either of them,LOCATION1 - safety ~~ LOCATION2 - safety,AD
LOCATION1 and LOCATION2 are good,LOCATION1 - general ~~ LOCATION2 - general,AD
"LOCATION1 and LOCATION2 are good if you want more of a London vibe , though they are slightly more dangerous",LOCATION1 - general ~~ LOCATION1 - safety ~~ LOCATION2 - general ~~ LOCATION2 - safety,AD
"LOCATION1 and LOCATION2 are great places to live , also , central but thats BARRRRE expensive lol",LOCATION2 - transit-location ~~ LOCATION1 - price ~~ LOCATION2 - live ~~ LOCATION2 - price ~~ LOCATION1 - transit-location ~~ LOCATION1 - live,AD
LOCATION1 and LOCATION2 are known as the Jewish Areas of London in North London,LOCATION1 - multicultural ~~ LOCATION2 - multicultural,AD
LOCATION1 and LOCATION2 are nice,LOCATION1 - general ~~ LOCATION2 - general,AD
LOCATION1 and LOCATION2 are probably your best bet,LOCATION1 - general ~~ LOCATION2 - general,AD
LOCATION1 and LOCATION2 are probably your best bet,LOCATION1 - general ~~ LOCATION2 - general,AD
LOCATION1 and LOCATION2 are quiet,LOCATION2 - quiet ~~ LOCATION1 - quiet,AD
"LOCATION1 and LOCATION2 are residential , but further out",LOCATION1 - transit-location ~~ LOCATION2 - transit-location,AD
LOCATION1 and LOCATION2 are safe enough just avoid walking around at night alone I did my PGCE at Goldsmiths,LOCATION1 - safety ~~ LOCATION2 - safety,AD
LOCATION1 and LOCATION2 are the arty areas with lots of bands and night clubs,LOCATION1 - nightlife ~~ LOCATION2 - nightlife,AD
"LOCATION1 and LOCATION2 are the less affluent areas , and are actually where you might find some racism",LOCATION1 - multicultural ~~ LOCATION1 - price ~~ LOCATION2 - price ~~ LOCATION2 - multicultural,AD
LOCATION1 and LOCATION2 are without doubt the coolest places to live in London at the moment with the most happening nightlife,LOCATION2 - live ~~ LOCATION1 - live ~~ LOCATION1 - nightlife ~~ LOCATION2 - nightlife,AD
LOCATION1 and LOCATION2 both gorgeous places to be in because they are affluent areas,LOCATION1 - general ~~ LOCATION1 - price ~~ LOCATION2 - price ~~ LOCATION2 - general,AD
LOCATION1 and LOCATION2 dont have tubes but are well connected,LOCATION1 - transit-location ~~ LOCATION2 - transit-location,AD
LOCATION1 and LOCATION2 happen to be two of my most favourite places in London,LOCATION1 - general ~~ LOCATION2 - general,AD
"LOCATION1 and LOCATION2, feels unsafe and people look a bit scary and dodgy",LOCATION1 - safety ~~ LOCATION2 - safety,AD
LOCATION1 and all nearby areas are very nice too,LOCATION1 - general,AD
LOCATION1 and the surrounding area are the Muslim areas,LOCATION1 - multicultural,AD
"LOCATION1 and the surrounding area is becoming more popular, but I still wouldn't choose to live there",LOCATION1 - general ~~ LOCATION1 - live,AD
"LOCATION1 and the surrounding areas are beautiful with lots of country pubs, village greens and historic National trust houses and castles to visit",LOCATION1 - green-nature ~~ LOCATION1 - nightlife,AD
LOCATION1 area is probably my favorite part of the area as it has a village like setting,LOCATION1 - general,AD
LOCATION1 area it is like cool,LOCATION1 - general,AD
"LOCATION1 around Coram Fields is very central, very 'child-friendly', and very 'teen-ager-friendly' too",LOCATION1 - transit-location,AD
LOCATION1 but is proper expensive,LOCATION1 - price,AD
LOCATION1 can be a nice area as well a bit of an ` up and coming ' area if you like,LOCATION1 - general,AD
LOCATION1 can be fun,LOCATION1 - general,AD
