input_text_ids,input_text,target_text,prefix
1004293:0,"Judging from previous posts this used to be a good place , but not any longer . </s>",The review expressed [negative] opinion on [restaurant general] for [place] </s>,TASD
1004293:1,"We , there were four of us , arrived at noon - the place was empty - and the staff acted like we were imposing on them and they were very rude . </s>",The review expressed [negative] opinion on [service general] for [staff] </s>,TASD
1004293:2,"They never brought us complimentary noodles , ignored repeated requests for sugar , and threw our dishes on the table . </s>",The review expressed [negative] opinion on [service general] for [NULL] </s>,TASD
1004293:3,The food was lousy - too sweet or too salty and the portions tiny . </s>,"The review expressed [negative] opinion on [food quality] for [food], [negative] opinion on [food style_options] for [portions] </s>",TASD
1004293:4,"After all that , they complained to me about the small tip . </s>",The review expressed [negative] opinion on [service general] for [NULL] </s>,TASD
1004293:5,Avoid this place ! </s>,The review expressed [negative] opinion on [restaurant general] for [place] </s>,TASD
1014458:0,"I have eaten at Saul , many times , the food is always consistently , outrageously good . </s>",The review expressed [positive] opinion on [food quality] for [food] </s>,TASD
1014458:1,Saul is the best restaurant on Smith Street and in Brooklyn . </s>,The review expressed [positive] opinion on [restaurant general] for [Saul] </s>,TASD
1014458:2,The duck confit is always amazing and the foie gras terrine with figs was out of this world . </s>,"The review expressed [positive] opinion on [food quality] for [duck confit], [positive] opinion on [food quality] for [foie gras terrine with figs] </s>",TASD
1014458:3,The wine list is interesting and has many good values . </s>,"The review expressed [positive] opinion on [drinks style_options] for [wine list], [positive] opinion on [drinks prices] for [wine list] </s>",TASD
1014458:4,"For the price , you cannot eat this well in Manhattan . </s>","The review expressed [positive] opinion on [food quality] for [NULL], [positive] opinion on [restaurant prices] for [NULL] </s>",TASD
1016296:0,I was very disappointed with this restaurant . </s>,The review expressed [negative] opinion on [restaurant general] for [restaurant] </s>,TASD
1016296:1,Ive asked a cart attendant for a lotus leaf wrapped rice and she replied back rice and just walked away . </s>,The review expressed [negative] opinion on [service general] for [cart attendant] </s>,TASD
1016296:2,I had to ask her three times before she finally came back with the dish Ive requested . </s>,The review expressed [negative] opinion on [service general] for [NULL] </s>,TASD
1016296:3,"Food was okay , nothing great . </s>",The review expressed [neutral] opinion on [food quality] for [Food] </s>,TASD
1016296:4,Chow fun was dry ; pork shu mai was more than usually greasy and had to share a table with loud and rude family . </s>,"The review expressed [negative] opinion on [food quality] for [Chow fun], [negative] opinion on [food quality] for [pork shu mai], [negative] opinion on [restaurant miscellaneous] for [NULL] </s>",TASD
1016296:5,I / we will never go back to this place again . </s>,The review expressed [negative] opinion on [restaurant general] for [place] </s>,TASD
1028246:0,"Went on a 3 day oyster binge , with Fish bringing up the closing , and I am so glad this was the place it O trip ended , because it was so great ! </s>",The review expressed [positive] opinion on [restaurant general] for [Fish] </s>,TASD
1028246:1,"Service was devine , oysters where a sensual as they come , and the price can ' t be beat ! ! ! </s>","The review expressed [positive] opinion on [service general] for [Service], [positive] opinion on [food quality] for [oysters], [positive] opinion on [restaurant prices] for [NULL] </s>",TASD
1028246:2,You can ' t go wrong here . </s>,The review expressed [positive] opinion on [restaurant general] for [NULL] </s>,TASD
1032695:0,Every time in New York I make it a point to visit Restaurant Saul on Smith Street . </s>,The review expressed [positive] opinion on [restaurant general] for [Restaurant Saul] </s>,TASD
1032695:1,"Everything is always cooked to perfection , the service is excellent , the decor cool and understated . </s>","The review expressed [positive] opinion on [service general] for [service], [positive] opinion on [food quality] for [NULL], [positive] opinion on [ambience general] for [decor] </s>",TASD
1032695:2,I had the duck breast special on my last visit and it was incredible . </s>,The review expressed [positive] opinion on [food quality] for [duck breast special] </s>,TASD
1032695:3,Can ' t wait wait for my next visit . </s>,The review expressed [positive] opinion on [restaurant general] for [NULL] </s>,TASD
1041457:1,And I hate to say this but I doubt I ' ll ever go back . </s>,The review expressed [negative] opinion on [restaurant general] for [NULL] </s>,TASD
1041457:2,"The food is very average . . . the Thai fusion stuff is a bit too sweet , every thing they serve is too sweet here . </s>","The review expressed [negative] opinion on [food quality] for [food], [negative] opinion on [food quality] for [Thai fusion stuff] </s>",TASD
1041457:3,The only thing I moderately enjoyed was their Grilled Chicken special with Edamame Puree . </s>,The review expressed [positive] opinion on [food quality] for [Grilled Chicken special with Edamame Puree] </s>,TASD
1041457:4,I had never had Edamame pureed before but I thought it was innovative and tasty ( could ' ve used a bit more salt ) . </s>,"The review expressed [positive] opinion on [food quality] for [Edamame pureed], [positive] opinion on [food style_options] for [Edamame pureed] </s>",TASD
1041457:6,"The decor is night tho . . . but they REALLY need to clean that vent in the ceiling . . . its quite un - appetizing , and kills your effort to make this place look sleek and modern . </s>","The review expressed [positive] opinion on [ambience general] for [decor], [negative] opinion on [ambience general] for [vent], [negative] opinion on [ambience general] for [place] </s>",TASD
1053543:2,"Their sake list was extensive , but we were looking for Purple Haze , which wasn ' t listed but made for us upon request ! </s>","The review expressed [positive] opinion on [service general] for [NULL], [positive] opinion on [drinks style_options] for [sake list] </s>",TASD
1053543:3,"The spicy tuna roll was unusually good and the rock shrimp tempura was awesome , great appetizer to share ! </s>","The review expressed [positive] opinion on [food quality] for [spicy tuna roll], [positive] opinion on [food quality] for [rock shrimp tempura] </s>",TASD
1053543:4,We went around 9 : 30 on a Friday and it had died down a bit by then so the service was great ! </s>,The review expressed [positive] opinion on [service general] for [service] </s>,TASD
1055910:0,we love th pink pony . </s>,The review expressed [positive] opinion on [restaurant general] for [pink pony] </s>,TASD
1055910:1,THe perfect spot . </s>,The review expressed [positive] opinion on [restaurant general] for [spot] </s>,TASD
1055910:2,Food - awesome . </s>,The review expressed [positive] opinion on [food quality] for [NULL] </s>,TASD
1055910:3,Service - friendly and attentive . </s>,The review expressed [positive] opinion on [service general] for [NULL] </s>,TASD
1055910:4,Ambiance - relaxed and stylish . </s>,The review expressed [positive] opinion on [ambience general] for [NULL] </s>,TASD
1055910:5,"Don ' t judge this place prima facie , you have to try it to believe it , a home away from home for the literate heart . </s>",The review expressed [positive] opinion on [restaurant general] for [place] </s>,TASD
1058221:2,the food is decent . </s>,The review expressed [neutral] opinion on [food quality] for [food] </s>,TASD
1058221:3,"however , it ' s the service that leaves a bad taste in my mouth . </s>",The review expressed [negative] opinion on [service general] for [service] </s>,TASD
1058221:4,"i happen to have a policy that goes along with a little bit of self - respect , which includes not letting a waiter intimidate me , i . e . make me feel bad asking for trivialities like water , or the check . </s>",The review expressed [negative] opinion on [service general] for [waiter] </s>,TASD
1058221:5,"i know , you were too busy showing off your vintage tee shirt and looking bored , but my agenda is i ' m here to eat and enjoy the company of friends , seeking a pleasant experience . </s>",The review expressed [negative] opinion on [service general] for [NULL] </s>,TASD
1058221:6,"well , i didn ' t find it there , and trust , i have told everyone i can think of about my experience . </s>",The review expressed [negative] opinion on [restaurant general] for [NULL] </s>,TASD
1058221:7,the last time i walked by it looked pretty empty . hmmm . </s>,The review expressed [negative] opinion on [restaurant miscellaneous] for [NULL] </s>,TASD
1062641:0,This place has got to be the best japanese restaurant in the new york area . </s>,The review expressed [positive] opinion on [restaurant general] for [place] </s>,TASD
1062641:1,I had a great experience . </s>,The review expressed [positive] opinion on [restaurant general] for [NULL] </s>,TASD
1062641:2,Food is great . </s>,The review expressed [positive] opinion on [food quality] for [Food] </s>,TASD
1062641:3,Service is top notch . </s>,The review expressed [positive] opinion on [service general] for [Service] </s>,TASD
1062641:4,I have been going back again and again . </s>,The review expressed [positive] opinion on [restaurant general] for [NULL] </s>,TASD
1064477:0,"I tend to judge a sushi restaurant by its sea urchin , which was heavenly at sushi rose . </s>",The review expressed [positive] opinion on [food quality] for [sea urchin] </s>,TASD
1064477:1,"It melted in my little mouth and the perfect consistency - not too fishy , creamy , and slightly buttery . </s>",The review expressed [positive] opinion on [food quality] for [NULL] </s>,TASD
1064477:2,The sushi seemed pretty fresh and was adequately proportioned . </s>,"The review expressed [positive] opinion on [food quality] for [sushi], [positive] opinion on [food style_options] for [sushi] </s>",TASD
1064477:3,The rice to fish ration was also good - - they didn ' t try to overpack the rice . </s>,The review expressed [positive] opinion on [food style_options] for [rice to fish ration] </s>,TASD
1064477:4,We took advanatage of the half price sushi deal on saturday so it was well worth it . </s>,"The review expressed [positive] opinion on [food quality] for [half price sushi deal], [positive] opinion on [food prices] for [half price sushi deal] </s>",TASD
1074868:2,Surprisingly nothing could be further from the truth . </s>,The review expressed [positive] opinion on [restaurant miscellaneous] for [NULL] </s>,TASD
1074868:3,"In the evening , this place attracted a well dressed , with it , NY crowd . </s>",The review expressed [positive] opinion on [restaurant miscellaneous] for [crowd] </s>,TASD
1074868:4,The food was well prepared and the service impecable . </s>,"The review expressed [positive] opinion on [service general] for [service], [positive] opinion on [food quality] for [food] </s>",TASD
1074868:5,I ' m going back . </s>,The review expressed [positive] opinion on [restaurant general] for [NULL] </s>,TASD
1084394:1,Quite simply it ' s like stepping out of Manhattan and into a haven of tranquility . </s>,The review expressed [positive] opinion on [ambience general] for [NULL] </s>,TASD
1084394:3,The Prix Fixe menu is worth every penny and you get more than enough ( both in quantity AND quality ) . </s>,"The review expressed [positive] opinion on [food quality] for [Prix Fixe menu], [positive] opinion on [food style_options] for [Prix Fixe menu], [positive] opinion on [food prices] for [Prix Fixe menu] </s>",TASD
1084394:4,I will be going back and heartily recommend it ! </s>,The review expressed [positive] opinion on [restaurant general] for [NULL] </s>,TASD
1086415:1,"It is terrific , as is the value . </s>","The review expressed [positive] opinion on [food quality] for [NULL], [positive] opinion on [food prices] for [NULL] </s>",TASD
1086415:2,"$ 6 and there is much tasty food , all of it fresh and continually refilled . </s>","The review expressed [positive] opinion on [food quality] for [food], [positive] opinion on [food style_options] for [food], [positive] opinion on [food prices] for [food] </s>",TASD
1086415:3,"I am not a vegetarian but , almost all the dishes were great . </s>",The review expressed [positive] opinion on [food quality] for [dishes] </s>,TASD
1086415:5,Go hungry and enjoy . </s>,The review expressed [positive] opinion on [restaurant general] for [NULL] </s>,TASD
1086478:0,"The food here is rather good , but only if you like to wait for it . </s>","The review expressed [negative] opinion on [service general] for [NULL], [positive] opinion on [food quality] for [food] </s>",TASD
1086478:1,"I like the somosas , chai , and the chole , but the dhosas and dhal were kinda dissapointing . </s>","The review expressed [positive] opinion on [food quality] for [somosas], [positive] opinion on [food quality] for [chai], [positive] opinion on [food quality] for [chole], [negative] opinion on [food quality] for [dhosas], [negative] opinion on [food quality] for [dhal] </s>",TASD
1086478:2,"The service varys from day to day - sometimes they ' re very nice , and sometimes not . </s>",The review expressed [negative] opinion on [service general] for [service] </s>,TASD
1086478:3,"The kitchen however , is almost always slow . </s>",The review expressed [negative] opinion on [service general] for [kitchen] </s>,TASD
1086478:4,"Also , specify if you like your food spicy - its rather bland if you don ' t . </s>",The review expressed [negative] opinion on [food quality] for [food] </s>,TASD
1086478:5,"The ambience is pretty and nice for conversation , so a casual lunch here would probably be best . </s>","The review expressed [positive] opinion on [restaurant miscellaneous] for [NULL], [positive] opinion on [ambience general] for [ambience] </s>",TASD
1090587:1,If you ' ve ever been along the river in Weehawken you have an idea of the top of view the chart house has to offer . </s>,The review expressed [positive] opinion on [location general] for [view] </s>,TASD
1090587:2,Add to that great service and great food at a reasonable price and you have yourself the beginning of a great evening . </s>,"The review expressed [positive] opinion on [service general] for [service], [positive] opinion on [food quality] for [food], [positive] opinion on [food prices] for [food] </s>",TASD
1090587:3,The lava cake dessert was incredible and I recommend it . </s>,The review expressed [positive] opinion on [food quality] for [lava cake dessert] </s>,TASD
1102681:0,"Once you step into Cosette , you ' re miraculously in a small , off - the - beaten path Parisian bistro . </s>",The review expressed [positive] opinion on [ambience general] for [Cosette] </s>,TASD
1102681:1,"This tiny restaurant is as cozy as it gets , with that certain Parisian flair . </s>",The review expressed [positive] opinion on [ambience general] for [restaurant] </s>,TASD
1102681:2,"The food was average to above - average ; the French Onion soup filling yet not overly impressive , and the desserts not brilliant in any way . </s>","The review expressed [positive] opinion on [food quality] for [food], [negative] opinion on [food quality] for [French Onion soup], [negative] opinion on [food quality] for [desserts], [positive] opinion on [food style_options] for [French Onion soup] </s>",TASD
1102681:3,"However , go for the ambience , and consider the food just a companion for a trip across the world ! </s>","The review expressed [neutral] opinion on [food quality] for [food], [positive] opinion on [ambience general] for [ambience] </s>",TASD
1118167:1,IT WAS HORRIBLE . </s>,The review expressed [negative] opinion on [restaurant general] for [NULL] </s>,TASD
1118167:2,The pizza was delivered cold and the cheese wasn ' t even fully melted ! </s>,"The review expressed [negative] opinion on [food quality] for [pizza], [negative] opinion on [food quality] for [cheese] </s>",TASD
1118167:3,It looked like shredded cheese partly done - still in strips . </s>,The review expressed [negative] opinion on [food style_options] for [NULL] </s>,TASD
1119578:0,This has got to be one of the most overrated restaurants in Brooklyn . </s>,The review expressed [negative] opinion on [restaurant general] for [NULL] </s>,TASD
1119578:1,The pizza is overpriced and soggy . </s>,"The review expressed [negative] opinion on [food quality] for [pizza], [negative] opinion on [food prices] for [pizza] </s>",TASD
1119578:2,"Yes , they use fancy ingredients , but even fancy ingredients don ' t make for good pizza unless someone knows how to get the crust right . </s>","The review expressed [positive] opinion on [food quality] for [ingredients], [negative] opinion on [food quality] for [pizza], [negative] opinion on [food quality] for [crust] </s>",TASD
1119578:3,"A big disappointment , all around . </s>",The review expressed [negative] opinion on [restaurant general] for [NULL] </s>,TASD
1123262:0,I think I ' ve had some the best meals of my life at minnow . </s>,The review expressed [positive] opinion on [food quality] for [meals] </s>,TASD
1123262:1,"The seafood is amazing , there ' s a good wine list , and the ever - changing menu always offers some great surprises . </s>","The review expressed [positive] opinion on [food quality] for [seafood], [positive] opinion on [food style_options] for [menu], [positive] opinion on [drinks style_options] for [wine list] </s>",TASD
1123262:2,The combination of super - fresh ingredients in the dishes are unusual but really delicious . </s>,The review expressed [positive] opinion on [food quality] for [ingredients] </s>,TASD
1123262:3,Worth the trip from Manhattan . </s>,The review expressed [positive] opinion on [restaurant general] for [NULL] </s>,TASD
1125006:1,Best Pastrami I ever had and great portion without being ridiculous . </s>,"The review expressed [positive] opinion on [food quality] for [Pastrami], [positive] opinion on [food style_options] for [portion] </s>",TASD
1125006:3,My wife had the fried shrimp which are huge and loved it . </s>,"The review expressed [positive] opinion on [food quality] for [fried shrimp], [positive] opinion on [food style_options] for [fried shrimp] </s>",TASD
1125284:0,"As a Japanese native , I ' ve lived in the Tristate area for over 8 years , but I was just so amazed at this place . </s>",The review expressed [positive] opinion on [restaurant general] for [place] </s>,TASD
1125284:1,This place is the most Japanese it can ever get . </s>,The review expressed [positive] opinion on [restaurant miscellaneous] for [place] </s>,TASD
1125284:2,"The signs , the specials menus , food , and even all the waitstaff are ALL TOTALLY Japanese . </s>","The review expressed [positive] opinion on [service general] for [waitstaff], [positive] opinion on [food quality] for [food], [positive] opinion on [food style_options] for [specials menus], [positive] opinion on [restaurant miscellaneous] for [signs] </s>",TASD
1125284:3,This place is worth an one - hour drive . </s>,The review expressed [positive] opinion on [restaurant general] for [place] </s>,TASD
1125284:4,"I am so coming back here again , as much as I can . </s>",The review expressed [positive] opinion on [restaurant general] for [NULL] </s>,TASD
1126814:0,"Leon is an East Village gem : casual but hip , with well prepared basic French bistro fare , good specials , a warm and lively atmosphere . </s>","The review expressed [positive] opinion on [restaurant general] for [Leon], [positive] opinion on [food quality] for [French bistro fare], [positive] opinion on [food quality] for [specials], [positive] opinion on [ambience general] for [Leon], [positive] opinion on [ambience general] for [atmosphere] </s>",TASD
1126814:1,"My wife and I always enjoy the young , not always well trained but nevertheless friendly , staff , all of whom have a story . </s>",The review expressed [positive] opinion on [service general] for [staff] </s>,TASD
1126814:3,Decent wine at reasonable prices . </s>,"The review expressed [positive] opinion on [drinks prices] for [wine], [neutral] opinion on [drinks quality] for [wine] </s>",TASD
1126814:4,Have been dozens of times and never failed to enjoy the experience . </s>,The review expressed [positive] opinion on [restaurant general] for [NULL] </s>,TASD
1126814:5,"Our teenage kids love it , too . </s>",The review expressed [positive] opinion on [restaurant general] for [NULL] </s>,TASD
1126886:0,"Everytime I decide to try another place on the UES , I get angry that I didn ' t just go to Zucchero Pomodori . </s>",The review expressed [positive] opinion on [restaurant general] for [Zucchero Pomodori] </s>,TASD
1126886:1,This is by far my favorite place in the neighborhood . </s>,The review expressed [positive] opinion on [restaurant general] for [place] </s>,TASD
1126886:2,"The service is excellent , the decor is great , and the food is delicious and comes in large portions . </s>","The review expressed [positive] opinion on [service general] for [service], [positive] opinion on [food quality] for [food], [positive] opinion on [food style_options] for [portions], [positive] opinion on [ambience general] for [decor] </s>",TASD
1126886:4,I ' m partial to the Gnocchi . </s>,The review expressed [positive] opinion on [restaurant general] for [Gnocchi] </s>,TASD
1131595:0,This place is incredibly tiny . </s>,The review expressed [negative] opinion on [restaurant miscellaneous] for [place] </s>,TASD
1131595:1,They refuse to seat parties of 3 or more on weekends . </s>,The review expressed [negative] opinion on [service general] for [NULL] </s>,TASD
1131595:2,The hostess is rude to the point of being offensive . </s>,The review expressed [negative] opinion on [service general] for [hostess] </s>,TASD
1131595:3,The food was bland oily . </s>,The review expressed [negative] opinion on [food quality] for [food] </s>,TASD
1131595:4,I just don ' t understand all the hype . . . </s>,The review expressed [negative] opinion on [restaurant general] for [NULL] </s>,TASD
1138996:1,"We have been to this place many times , and always have great food , wine , and service . </s>","The review expressed [positive] opinion on [service general] for [service], [positive] opinion on [food quality] for [food], [positive] opinion on [drinks quality] for [wine] </s>",TASD
1138996:2,"We were worried we would have trouble getting in , but somehow managed to have a short wait . </s>",The review expressed [positive] opinion on [service general] for [wait] </s>,TASD
1138996:3,As always we had a great glass of wine while we waited . </s>,The review expressed [positive] opinion on [drinks quality] for [glass of wine] </s>,TASD
1138996:4,"When we sat , we got great and fast service . </s>",The review expressed [positive] opinion on [service general] for [service] </s>,TASD
1138996:5,The people that work there are always so friendly you forget you are in New York sometimes . </s>,The review expressed [positive] opinion on [service general] for [people] </s>,TASD
1138996:6,Make sure you try this place as often as you can . </s>,The review expressed [positive] opinion on [restaurant general] for [place] </s>,TASD
1145510:0,This is a fun restaurant to go to . </s>,The review expressed [positive] opinion on [restaurant general] for [restaurant] </s>,TASD
1145510:1,The pizza is yummy and I like the atmoshpere . </s>,"The review expressed [positive] opinion on [food quality] for [pizza], [positive] opinion on [ambience general] for [atmoshpere] </s>",TASD
1145510:2,But the pizza is way to expensive . </s>,The review expressed [negative] opinion on [food prices] for [pizza] </s>,TASD
1145510:3,"A large is $ 20 , and toppings are about $ 3 each . </s>",The review expressed [negative] opinion on [food prices] for [toppings] </s>,TASD
1147082:0,I went there for lunch and it was not as good as I expected from the reviews I read . </s>,The review expressed [negative] opinion on [food quality] for [lunch] </s>,TASD
1147082:1,Sauce was watery and the food didn ' t have much flavor . </s>,"The review expressed [negative] opinion on [food quality] for [Sauce], [negative] opinion on [food quality] for [food] </s>",TASD
1147082:3,I don ' t think I would go again . </s>,The review expressed [negative] opinion on [restaurant general] for [NULL] </s>,TASD
1147211:0,This place is great . </s>,The review expressed [positive] opinion on [restaurant general] for [place] </s>,TASD
1147211:1,I had a huge group for my birthday and we were well taken care of . </s>,The review expressed [positive] opinion on [service general] for [NULL] </s>,TASD
1147211:2,The waitress was very patient with us and the food is phenomenal ! </s>,"The review expressed [positive] opinion on [service general] for [waitress], [positive] opinion on [food quality] for [food] </s>",TASD
1147211:3,"Service was prompt , friendly and great . </s>",The review expressed [positive] opinion on [service general] for [Service] </s>,TASD
1147211:4,Slightly on the pricey side but worth it ! </s>,"The review expressed [positive] opinion on [restaurant general] for [NULL], [negative] opinion on [restaurant prices] for [NULL] </s>",TASD
1153034:0,Great pizza and fantastic service . </s>,"The review expressed [positive] opinion on [service general] for [service], [positive] opinion on [food quality] for [pizza] </s>",TASD
