input_text_ids,input_text,target_text,prefix
470488:3,The rice was poor quality and was cooked so badly it was hard . </s>,The review expressed [negative] opinion on [food quality] for [rice] </s>,TASD
470488:4,"Furthermore , the rice had no seasoning , so the sushi was bland and disgusting . </s>","The review expressed [negative] opinion on [food quality] for [rice], [negative] opinion on [food quality] for [sushi] </s>",TASD
470488:5,"The fish was adequate , but inexpertly sliced . </s>",The review expressed [negative] opinion on [food style_options] for [fish] </s>,TASD
470488:6,It is obvious that no one in the restaurant has any idea about or experience with Japanese cuisine . </s>,The review expressed [negative] opinion on [food quality] for [Japanese cuisine] </s>,TASD
475298:0,"Good , fast service . </s>",The review expressed [positive] opinion on [service general] for [service] </s>,TASD
475298:1,I would highly recommend . </s>,The review expressed [positive] opinion on [restaurant general] for [NULL] </s>,TASD
475298:2,Food is great and inexpensive . </s>,"The review expressed [positive] opinion on [food quality] for [Food], [positive] opinion on [food prices] for [Food] </s>",TASD
475298:3,The location is perfect . </s>,The review expressed [positive] opinion on [location general] for [location] </s>,TASD
475298:4,Give it a try and enjoy . </s>,The review expressed [positive] opinion on [restaurant general] for [NULL] </s>,TASD
475512:2,"Well , this place is so Ghetto its not even funny . </s>",The review expressed [negative] opinion on [ambience general] for [place] </s>,TASD
475512:3,If you like your music blasted and the system isnt that great and if you want to pay at least 100 dollar bottle minimun then you ' ll love it here . </s>,"The review expressed [negative] opinion on [drinks prices] for [bottle minimun], [negative] opinion on [ambience general] for [music] </s>",TASD
475512:4,Would NEVER go back there . </s>,The review expressed [negative] opinion on [restaurant general] for [NULL] </s>,TASD
476473:0,Awsome Pizza especially the Margheritta slice . </s>,"The review expressed [positive] opinion on [food quality] for [Pizza], [positive] opinion on [food quality] for [Margheritta slice] </s>",TASD
476473:1,Always busy but fast moving . </s>,The review expressed [positive] opinion on [service general] for [NULL] </s>,TASD
476473:2,Great atmoshere and worth every bit . </s>,"The review expressed [positive] opinion on [restaurant general] for [NULL], [positive] opinion on [ambience general] for [atmoshere] </s>",TASD
476473:3,Open late ( well as late as I ever got there and I ' m a night person ) </s>,The review expressed [positive] opinion on [restaurant miscellaneous] for [NULL] </s>,TASD
483111:0,Winnie and her staff are the best crew you can find serving you . </s>,"The review expressed [positive] opinion on [service general] for [Winnie], [positive] opinion on [service general] for [staff] </s>",TASD
483111:1,The food is reliable and the price is moderate . </s>,"The review expressed [positive] opinion on [food quality] for [food], [neutral] opinion on [restaurant prices] for [NULL] </s>",TASD
483111:2,What more can you ask for ? </s>,The review expressed [positive] opinion on [restaurant general] for [NULL] </s>,TASD
485026:0,"For authentic Thai food , look no further than Toons . </s>",The review expressed [positive] opinion on [food quality] for [Thai food] </s>,TASD
485026:2,"Try the Pad Thai , or sample anything on the appetizer menu . . . they ' re all delicious . </s>","The review expressed [positive] opinion on [food quality] for [Pad Thai], [positive] opinion on [food quality] for [appetizer menu] </s>",TASD
485767:0,Everything about this restaurant was special . </s>,The review expressed [positive] opinion on [restaurant general] for [restaurant] </s>,TASD
485767:1,"The service was attentive , yet discreet . </s>",The review expressed [positive] opinion on [service general] for [service] </s>,TASD
485767:2,The flavors robust and subtle . </s>,The review expressed [positive] opinion on [food quality] for [NULL] </s>,TASD
485767:3,The brioche and lollies as party favors is a cute and sweet touch to a most memorable meal . </s>,The review expressed [positive] opinion on [food quality] for [brioche and lollies] </s>,TASD
485767:4,I ' m saving up for my next visit . </s>,The review expressed [positive] opinion on [restaurant general] for [NULL] </s>,TASD
485966:1,The place was quiet and delightful . </s>,The review expressed [positive] opinion on [ambience general] for [place] </s>,TASD
485966:2,Service was good and food is wonderful . </s>,"The review expressed [positive] opinion on [service general] for [Service], [positive] opinion on [food quality] for [food] </s>",TASD
485966:3,I did not try the caviar but I tried their salmon and crab salad ( they are all good ) </s>,"The review expressed [positive] opinion on [food quality] for [salmon], [positive] opinion on [food quality] for [crab salad] </s>",TASD
485966:4,It is definitely a good spot for snacks and chat . </s>,The review expressed [positive] opinion on [restaurant general] for [spot] </s>,TASD
490565:0,"As a retired hipster , I can say with some degree of certainty that for the last year Lucky Strike has been the best laid - back late night in the city . </s>",The review expressed [positive] opinion on [restaurant general] for [Lucky Strike] </s>,TASD
490565:1,"The wait staff is pleasant , fun , and for the most part gorgeous ( in the wonderful aesthetic beautification way , not in that she ' s - way - cuter - than - me - that - b @ # $ * way ) . </s>",The review expressed [positive] opinion on [service general] for [wait staff] </s>,TASD
490565:2,"The food is yummy , especially their cooked - to - perfection mussels in spicy tomato sauce and their shoestring crispy fries . </s>","The review expressed [positive] opinion on [food quality] for [food], [positive] opinion on [food quality] for [mussels in spicy tomato sauce], [positive] opinion on [food quality] for [fries] </s>",TASD
490565:3,"But the best part about LS is the late night atmosphere , delightfully free of the BTs . </s>",The review expressed [positive] opinion on [ambience general] for [late night atmosphere] </s>,TASD
490565:4,"You can get a completely delish martini in a glass ( that ' s about 2 1 / 2 drinks ) for $ 8 . 50 ( I recommend the Vanilla Shanty , mmmm ! ) in a great homey setting with great music . </s>","The review expressed [positive] opinion on [drinks style_options] for [martini], [positive] opinion on [drinks prices] for [martini], [positive] opinion on [ambience general] for [setting], [positive] opinion on [ambience general] for [music], [positive] opinion on [drinks quality] for [martini], [positive] opinion on [drinks quality] for [Vanilla Shanty] </s>",TASD
490565:5,"The in - house lady DJ on Saturday nights has outrageously good taste in music , and moreover , takes requests . </s>",The review expressed [positive] opinion on [ambience general] for [in - house lady DJ] </s>,TASD
490565:6,You can ' t go wrong with this place . </s>,The review expressed [positive] opinion on [restaurant general] for [place] </s>,TASD
493013:0,Suan is a great place that I often take my friends ( classmates ) too . </s>,The review expressed [positive] opinion on [restaurant general] for [Suan] </s>,TASD
493013:1,"Its location is good and the fact that Hutner College is near and their prices are very reasonable , makes students go back to Suan again and again . </s>","The review expressed [positive] opinion on [restaurant prices] for [Suan], [positive] opinion on [location general] for [location] </s>",TASD
493013:2,I LOVE their Thai </s>,The review expressed [positive] opinion on [food quality] for [Thai] </s>,TASD
493013:3,noodles with shrimp and chicken and coconut juice is the MUST ! </s>,The review expressed [positive] opinion on [food quality] for [noodles with shrimp and chicken and coconut juice] </s>,TASD
493013:5,I will go back to Suan soon ! </s>,The review expressed [positive] opinion on [restaurant general] for [Suan] </s>,TASD
493013:6,In summer - eat outside on a terrace ( another great feature of Suan ) ! ! ! </s>,The review expressed [positive] opinion on [ambience general] for [terrace] </s>,TASD
493514:0,I cannot imagine a friendlier staff working in a restaurant . </s>,The review expressed [positive] opinion on [service general] for [staff] </s>,TASD
493514:1,I cannot imagine better Indian food in all of the city . </s>,The review expressed [positive] opinion on [food quality] for [Indian food] </s>,TASD
493514:2,I cannot imagine you not rushing out to eat there . </s>,The review expressed [positive] opinion on [restaurant general] for [NULL] </s>,TASD
494850:1,"During the course of the past 3 months , the chef and staff changed and it was not for the better . </s>","The review expressed [negative] opinion on [service general] for [staff], [negative] opinion on [food quality] for [chef] </s>",TASD
494850:2,I wish they would change back to what it was before . </s>,The review expressed [negative] opinion on [restaurant general] for [NULL] </s>,TASD
494850:3,The food now is inconsistent . </s>,The review expressed [negative] opinion on [food quality] for [food] </s>,TASD
496132:0,This is the kind of place you ' d like to take all your friends to and still keep a secret . </s>,The review expressed [positive] opinion on [restaurant miscellaneous] for [place] </s>,TASD
496132:1,The setting is casual and romantic . </s>,The review expressed [positive] opinion on [ambience general] for [setting] </s>,TASD
496132:2,Prices are very good . </s>,The review expressed [positive] opinion on [restaurant prices] for [NULL] </s>,TASD
496132:3,The food is excellent ! </s>,The review expressed [positive] opinion on [food quality] for [food] </s>,TASD
496132:4,"if you ' re daring , try the balsamic vinegar over icecream , it ' s wonderful ! </s>",The review expressed [positive] opinion on [food quality] for [balsamic vinegar over icecream] </s>,TASD
498657:0,"Do not get the Go Go Hamburgers , no matter what the reviews say . </s>",The review expressed [negative] opinion on [food quality] for [Go Go Hamburgers] </s>,TASD
498657:1,They were such a rip - off ( $ 8 . 95 for four small meat patties in steamed buns ) and not worth trying . </s>,"The review expressed [negative] opinion on [food quality] for [NULL], [negative] opinion on [food style_options] for [NULL], [negative] opinion on [food prices] for [NULL] </s>",TASD
498657:2,"The rest of the dim sum , though pricey by Chinatown standards , is worth it . </s>","The review expressed [positive] opinion on [food quality] for [dim sum], [negative] opinion on [food prices] for [dim sum] </s>",TASD
498657:3,Steamed fresh so brought hot hot hot to your table . </s>,The review expressed [positive] opinion on [food quality] for [NULL] </s>,TASD
498657:4,"The wait here is long for dim sum , but if you don ' t like sharing tables or if the typical raucous dim sum atmosphere is not your gig , this is a sleek ( for Chinatown ) alternative . </s>","The review expressed [negative] opinion on [service general] for [wait], [negative] opinion on [restaurant miscellaneous] for [NULL], [negative] opinion on [ambience general] for [atmosphere] </s>",TASD
498657:5,"A few tips : skip the turnip cake , roast pork buns and egg custards . </s>","The review expressed [negative] opinion on [food quality] for [turnip cake], [negative] opinion on [food quality] for [roast pork buns], [negative] opinion on [food quality] for [egg custards] </s>",TASD
498657:6,These are overpriced and you can get better just around the corner : </s>,"The review expressed [negative] opinion on [food quality] for [NULL], [negative] opinion on [food prices] for [NULL] </s>",TASD
503807:1,I was pleasantly suprised . </s>,The review expressed [positive] opinion on [restaurant general] for [NULL] </s>,TASD
503807:2,The food was exceptional . </s>,The review expressed [positive] opinion on [food quality] for [food] </s>,TASD
503807:4,"I choose to go with one of the special , the braised lamb shank in red wine , which was excellent . </s>",The review expressed [positive] opinion on [food quality] for [braised lamb shank in red wine] </s>,TASD
503807:5,The service was friendly and the atmosphere was casual . </s>,"The review expressed [positive] opinion on [service general] for [service], [neutral] opinion on [ambience general] for [atmosphere] </s>",TASD
503807:6,The restaurant is a bit noisy but that is something that can be overlooked once you sit down and enjoy a great meal </s>,"The review expressed [positive] opinion on [food quality] for [meal], [neutral] opinion on [ambience general] for [restaurant] </s>",TASD
505535:0,this little place has a cute interior decor and affordable city prices . </s>,"The review expressed [positive] opinion on [restaurant prices] for [place], [positive] opinion on [ambience general] for [interior decor] </s>",TASD
505535:1,"the pad se ew chicken was delicious , however the pad thai was far too oily . </s>","The review expressed [positive] opinion on [food quality] for [pad se ew chicken], [negative] opinion on [food quality] for [pad thai] </s>",TASD
507755:0,"Have eaten at Ginger House several times , and it ' s always good . </s>",The review expressed [positive] opinion on [restaurant general] for [Ginger House] </s>,TASD
507755:1,The fried dumplings are GREAT ! </s>,The review expressed [positive] opinion on [food quality] for [fried dumplings] </s>,TASD
507755:2,Finally a reliable Chinese restaurant ! </s>,The review expressed [positive] opinion on [restaurant general] for [Chinese restaurant] </s>,TASD
507844:0,This place would be so much better served by being run by a group that actually understands customer service . </s>,The review expressed [negative] opinion on [service general] for [customer service] </s>,TASD
507844:1,"The only thing you can do here is walk in and eat . . but planning an event , especially a small , intimate one , forget about it . </s>",The review expressed [negative] opinion on [restaurant miscellaneous] for [NULL] </s>,TASD
507844:2,"They are not helpful in the least and will give you the grand run around so by the time the event date rolls around you will not only regret chosing this place , but also become hostile ! </s>",The review expressed [negative] opinion on [service general] for [NULL] </s>,TASD
507844:3,"Nobody at this restaurant will give firm answers about anything and in the end , not one person takes responsibility for anything . </s>",The review expressed [negative] opinion on [service general] for [NULL] </s>,TASD
507844:4,"Terrible , terrible management - deserves to be shut - down . </s>","The review expressed [negative] opinion on [restaurant general] for [NULL], [negative] opinion on [service general] for [management] </s>",TASD
507937:0,Never fails to please . </s>,The review expressed [positive] opinion on [restaurant general] for [NULL] </s>,TASD
507937:1,"delicious bagels , especially when right out of the oven . </s>",The review expressed [positive] opinion on [food quality] for [bagels] </s>,TASD
507937:2,Spreads and toppings are great - though a bit pricey . </s>,"The review expressed [positive] opinion on [food quality] for [Spreads], [positive] opinion on [food quality] for [toppings], [negative] opinion on [food prices] for [Spreads], [negative] opinion on [food prices] for [toppings] </s>",TASD
507937:3,Service is fast and friendly . </s>,The review expressed [positive] opinion on [service general] for [Service] </s>,TASD
507937:4,"Only drawback - they won ' t toast your bagel , and they don ' t make eggs for the bagel . </s>",The review expressed [negative] opinion on [service general] for [NULL] </s>,TASD
507937:5,But that is highly forgivable . </s>,The review expressed [positive] opinion on [service general] for [NULL] </s>,TASD
509227:0,"Been there , done that , and New York , it ' s not that big a deal . </s>",The review expressed [neutral] opinion on [restaurant general] for [NULL] </s>,TASD
509227:1,"The food is decent at best , and the ambience , well , it ' s a matter of opinion , some may consider it to be a sweet thing , I thought it was just annoying . </s>","The review expressed [negative] opinion on [food quality] for [food], [negative] opinion on [ambience general] for [ambience] </s>",TASD
509227:2,"If celebrities make you sweat , then your in for a ride , but if your like most around these parts then you ' ll just yawn and wonder whats with all the hype . </s>",The review expressed [negative] opinion on [restaurant miscellaneous] for [NULL] </s>,TASD
509227:3,"Rao is a good restaurant , but it ' s nothing special . </s>",The review expressed [neutral] opinion on [restaurant general] for [Rao] </s>,TASD
511290:1,"But after last night , Spice Grill is the only place I ' m eating indian cuisine . </s>",The review expressed [positive] opinion on [food quality] for [indian cuisine] </s>,TASD
511290:2,You must try the shrimp appetizers . </s>,The review expressed [positive] opinion on [food quality] for [shrimp appetizers] </s>,TASD
511290:3,Even my Indian friend couldn ' t believe how good and tasty everything was . </s>,The review expressed [positive] opinion on [food quality] for [NULL] </s>,TASD
511290:4,This place has the the correct ambience and an excellent staff to make you feel like a guest and a friend at the same time . </s>,"The review expressed [positive] opinion on [service general] for [staff], [positive] opinion on [ambience general] for [ambience] </s>",TASD
512294:0,"Great food , great prices , great service . </s>","The review expressed [positive] opinion on [service general] for [service], [positive] opinion on [food quality] for [food], [positive] opinion on [restaurant prices] for [NULL] </s>",TASD
512294:1,"If you are looking for a good quality , cheap eats - this is the place . </s>","The review expressed [positive] opinion on [food quality] for [eats], [positive] opinion on [food prices] for [eats] </s>",TASD
512925:0,it ' s a perfect place to have a amanzing indian food . </s>,The review expressed [positive] opinion on [food quality] for [indian food] </s>,TASD
512925:1,I really loved the different and inovated touch that ' s the cheff gives to the food . </s>,The review expressed [positive] opinion on [food style_options] for [cheff] </s>,TASD
512925:2,"also it ' s great to have dinner in a very romantic and confortable place , the service it ' s just perfect . . . they ' re so frendly that we never want to live the place ! </s>","The review expressed [positive] opinion on [service general] for [service], [positive] opinion on [ambience general] for [place] </s>",TASD
513395:1,"Their bagels are fine , but they are a little overcooked , and not really a ' special ' bagel experience . </s>",The review expressed [negative] opinion on [food quality] for [bagels] </s>,TASD
513521:0,Great bagels made the old - fashioned way . </s>,"The review expressed [positive] opinion on [food quality] for [bagels], [positive] opinion on [food style_options] for [bagels] </s>",TASD
513521:2,Drawbacks : service is slow and they don ' t toast ! </s>,The review expressed [negative] opinion on [service general] for [service] </s>,TASD
519425:0,The food was absolutely amazing ! ! </s>,The review expressed [positive] opinion on [food quality] for [food] </s>,TASD
519425:1,The baked clams octopus we shared as appetizers were the best we ' ve ever had ! ! </s>,The review expressed [positive] opinion on [food quality] for [baked clams octopus] </s>,TASD
519425:2,"The lamb was tender so full of flavor , the dessert was divine ! ! </s>","The review expressed [positive] opinion on [food quality] for [lamb], [positive] opinion on [food quality] for [dessert] </s>",TASD
519425:3,The waiter was attentive . </s>,The review expressed [positive] opinion on [service general] for [waiter] </s>,TASD
519425:4,The place itself is beautiful the bar scene seems to be happening . </s>,"The review expressed [positive] opinion on [ambience general] for [place], [positive] opinion on [ambience general] for [bar scene] </s>",TASD
521916:0,"Downtown Dinner 2002 - Prixe fix : Appetizers were ok , waiter gave me poor suggestion . . try the potato stuff kanish best one . </s>","The review expressed [negative] opinion on [service general] for [waiter], [positive] opinion on [food quality] for [potato stuff kanish], [neutral] opinion on [food quality] for [Appetizers] </s>",TASD
521916:1,"Small servings for main entree , i had salmon ( wasnt impressed ) girlfriend had chicken , it was good . </s>","The review expressed [positive] opinion on [food quality] for [chicken], [negative] opinion on [food quality] for [salmon], [negative] opinion on [food style_options] for [servings for main entree] </s>",TASD
521916:2,Dessert is a joke . . . dont bother </s>,The review expressed [negative] opinion on [food quality] for [Dessert] </s>,TASD
527109:0,"Volare virgins or weekly regulars , everyone gets treated the same and you can ' t ask for more than that when the service is this friendly . </s>",The review expressed [positive] opinion on [service general] for [service] </s>,TASD
527109:1,"The restaurant has a Family feel , not least with regard to the portions which are enormous ; the veal alone could have single - handedly solved third world famine . </s>","The review expressed [positive] opinion on [food style_options] for [portions], [positive] opinion on [food style_options] for [veal], [positive] opinion on [ambience general] for [feel] </s>",TASD
527109:2,"The anti - pasta was excellent , especially the calamari , as were the filling pasta mains . </s>","The review expressed [positive] opinion on [food quality] for [anti - pasta], [positive] opinion on [food quality] for [calamari], [positive] opinion on [food quality] for [pasta mains], [positive] opinion on [food style_options] for [pasta mains] </s>",TASD
527109:3,The wine list is extensive and can easily hike up an otherwise reasonably priced meal . </s>,"The review expressed [positive] opinion on [drinks style_options] for [wine list], [positive] opinion on [food prices] for [meal] </s>",TASD
527109:4,"Still , any quibbles about the bill were off - set by the pour - your - own measures of liquers which were courtesey of the house . . . </s>","The review expressed [positive] opinion on [drinks style_options] for [measures of liquers], [neutral] opinion on [restaurant prices] for [NULL] </s>",TASD
528251:0,Fantastic place . </s>,The review expressed [positive] opinion on [restaurant general] for [place] </s>,TASD
528251:1,Cute and decorative . </s>,The review expressed [positive] opinion on [ambience general] for [NULL] </s>,TASD
528251:2,A pleasant surprise . </s>,The review expressed [positive] opinion on [restaurant general] for [NULL] </s>,TASD
528251:3,Go there to relax and feel like your somewhere else . </s>,The review expressed [positive] opinion on [ambience general] for [NULL] </s>,TASD
530517:0,Lucky Strike is a great casual place to just grab a bite to eat . </s>,The review expressed [positive] opinion on [restaurant general] for [Lucky Strike] </s>,TASD
530517:2,"Great food , great decor , great service . </s>","The review expressed [positive] opinion on [service general] for [service], [positive] opinion on [food quality] for [food], [positive] opinion on [ambience general] for [decor] </s>",TASD
530517:3,I recommend it ! </s>,The review expressed [positive] opinion on [restaurant general] for [NULL] </s>,TASD
535086:0,"This is the perfect spot for meeting friends , having lunch , dinner , pre - theatre or after - theatre drinks ! </s>",The review expressed [positive] opinion on [restaurant miscellaneous] for [spot] </s>,TASD
535086:1,( Always ask the bartender for the SEASONAL beer ! ! ! </s>,The review expressed [positive] opinion on [drinks quality] for [SEASONAL beer] </s>,TASD
535086:2,Guaranteed to be a tasty experience ! ) </s>,The review expressed [positive] opinion on [drinks quality] for [NULL] </s>,TASD
535086:3,Excellent spot for holiday get togethers with co - workers or friends that you haven ' t seen in a while . </s>,The review expressed [positive] opinion on [restaurant miscellaneous] for [spot] </s>,TASD
535086:4,I have been doing all of the above at the Heartland Brewery for over 5 years now and I HAVE NEVER BEEN DISAPPOINTED ! </s>,The review expressed [positive] opinion on [restaurant general] for [Heartland Brewery] </s>,TASD
535086:5,All the people that I bring there go back on their own and bring THEIR friends ! </s>,The review expressed [positive] opinion on [restaurant miscellaneous] for [NULL] </s>,TASD
535086:6,Go there once and oh yes . . . you will go back . . . you will . . . </s>,The review expressed [positive] opinion on [restaurant general] for [NULL] </s>,TASD
535171:0,What a great place ! </s>,The review expressed [positive] opinion on [restaurant general] for [place] </s>,TASD
535171:1,Not the typical NYC gimmick theme restaurant . </s>,The review expressed [positive] opinion on [ambience general] for [restaurant] </s>,TASD
535171:2,"A cool bar with great food , and tons of excellent beer . </s>","The review expressed [positive] opinion on [food quality] for [food], [positive] opinion on [drinks style_options] for [beer], [positive] opinion on [ambience general] for [bar], [positive] opinion on [drinks quality] for [beer] </s>",TASD
535171:3,And even with it ' s Pub atmosphere they were great to my kids too ! </s>,The review expressed [positive] opinion on [service general] for [NULL] </s>,TASD
535171:4,Loved it ! </s>,The review expressed [positive] opinion on [restaurant general] for [NULL] </s>,TASD
